Name,Website,Image,Bio
Selena Montgomery,https://selenamontgomery.com/,"https://img1.wsimg.com/isteam/ip/92f8f978-c8a6-4e00-83c6-45cb5a19b66d/fd03949c-a457-41f9-978a-d9f7784019c8.jpg/:/cr=t:6.83%25,l:0%25,w:100%25,h:64.94%25/rs=w:1136,h:568,cg:true","Selena Montgomery grew up in Mississippi and Georgia, with two incredible parents and five fascinating siblings. She is a graduate of Spelman College, the LBJ School of Public Affairs, and Yale Law School. She draws upon her interest in and experiences with social and economic policy, politics, and creative writing to fuel her novels. As her alter ego, Stacey Abrams, she served eleven years in the Georgia House of Representatives. In 2018, she became the Democratic nominee for Governor of Georgia, and is the first black woman and first Georgian to deliver a Response to the State of the Union."
Sheryl Lister,http://sheryllister.com/,https://images-na.ssl-images-amazon.com/images/S/amzn-author-media-prod/eaqmqbm9cbq9tqdv9laivfapgc._US230_.jpg,"Sheryl Lister has enjoyed reading and writing for as long as she can remember. After putting writing on the back burner for several years, she became serious about her craft in 2009. She writes contemporary and inspirational romance and romantic suspense. When she’s not reading, writing or playing chauffeur, Sheryl can be found on a date with her husband or in the kitchen creating appetizers and bite-sized desserts. Sheryl resides in California and is a wife, mother of three daughters, a son-in-love, and a proud grandmother. Sheryl is a member of RWA, Romance Writers of America®, “The Voice of Romance Writers,” as well as the Cultural, Interracial, and Multicultural Special Interest Chapter of Romance Writers of America (CIMRWA). She is represented by Sarah Younger of Nancy Yost Literary Agency."
Stephanie Nicole Norris,https://stephanienicolenorris.com/,https://stephanienicolenorris.com/wp-content/uploads/2020/11/stephaniecomput-714x1024.png,"Stephanie Nicole Norris is an author from Chattanooga, Tennessee, with a humble beginning. After becoming a young adult, her love for romance sparked, leaving her captivated by heroes and heroines alike."
Talia Hibbert,https://www.taliahibbert.com/,https://static.onecms.io/wp-content/uploads/sites/6/2019/03/talia-hibbert-author-photo_ed-chappell-uk-2000.jpg,"Talia Hibbert is a USA Today and Wall Street Journal bestselling author who lives in a bedroom full of books. Supposedly, there is a world beyond that room, but she has yet to drum up enough interest to investigate."
Therese Beharrie,http://theresebeharrie.com/,https://pbs.twimg.com/profile_images/1358719933128060929/7mNu4dFe.jpg,"Being an author has always been Therese’s dream. But it was only when the corporate world loomed during her final year at university that she realised how soon she wanted that dream to become a reality. So she got serious about her writing, entered the Harlequin So You Think You Can Write competition and got the attention of an editor. Now she writes books she wants to see in the world featuring people who look like her for a living. When she’s not writing, she’s spending time with her husband and dogs in Cape Town, South Africa."
Tiffany Patterson,https://tiffanypattersonwrites.com/,http://www.cherylholloway.net/blog/wp-content/uploads/2017/05/Tiffany-Patterson-300x225.jpg,"Reading romance and erotica started as a great way to de-stress at the end of the day. I came to enjoy and look forward to finding more Black authors telling stories of love and triumph. What I found most enticing about these stories is that for a few hours out of the day, I was able to pick up a book and read stories of people who looked like me falling in love. I was able to fall into a world in which people of color, in particular Black women, are cherished, loved and sometimes unabashedly sexual. I wanted more of this."
Vanessa Riley,https://vanessariley.com/,https://www.vanessariley.com/gotool/image/data/VanessaRileyHeadB737.jpg,"Vanessa Riley writes Historical Fiction and Historical Romance (Georgian, Regency, & Victorian) featuring hidden histories, dazzling multi-culture communities, and strong sisterhoods. She promises to pull heart strings, offer a few laughs, and share tidbits of tantalizing history. 
Her latest release, A Duke, The Lady, and A Baby is an Amazon Best of the Month Selection and a Publishers Weekly Summer Reads 2020 Editors' Pick. A Duke, The Lady, and A Baby has been reviewed by Entertainment Weekly, NPR, Library Journal, and the New York Times and received a starred review in Publishers Weekly."