Author,Book,Image,Year,Description,Buy,Book_old,file_number
Lindsay Evans,On-air passion,https://upload.wikimedia.org/wikipedia/commons/f/f9/Phoenicopterus_ruber_in_S%C3%A3o_Paulo_Zoo.jpg,2013,Stepping to a New Day Stepping to a New Day Stepping to a New Day Stepping to a New Day Stepping to a New Day Stepping to a New Day Stepping to a New Day Stepping to a New Day,https://www.awakenthegreatnesswithin.com/wp-content/uploads/2018/08/Nature-Quotes-1.jpg,On-air passion,283
Lindsay Evans,Pleasure under the sun,https://upload.wikimedia.org/wikipedia/commons/f/f9/Phoenicopterus_ruber_in_S%C3%A3o_Paulo_Zoo.jpg,2013,Stepping to a New Day Stepping to a New Day Stepping to a New Day Stepping to a New Day Stepping to a New Day Stepping to a New Day Stepping to a New Day Stepping to a New Day,https://www.awakenthegreatnesswithin.com/wp-content/uploads/2018/08/Nature-Quotes-1.jpg,Pleasure under the sun ,284
Lindsay Evans,Propositioning the professor,https://upload.wikimedia.org/wikipedia/commons/f/f9/Phoenicopterus_ruber_in_S%C3%A3o_Paulo_Zoo.jpg,2013,Stepping to a New Day Stepping to a New Day Stepping to a New Day Stepping to a New Day Stepping to a New Day Stepping to a New Day Stepping to a New Day Stepping to a New Day,https://www.awakenthegreatnesswithin.com/wp-content/uploads/2018/08/Nature-Quotes-1.jpg,Propositioning the professor,285
Lindsay Evans,Snowy mountain,https://upload.wikimedia.org/wikipedia/commons/f/f9/Phoenicopterus_ruber_in_S%C3%A3o_Paulo_Zoo.jpg,2013,Stepping to a New Day Stepping to a New Day Stepping to a New Day Stepping to a New Day Stepping to a New Day Stepping to a New Day Stepping to a New Day Stepping to a New Day,https://www.awakenthegreatnesswithin.com/wp-content/uploads/2018/08/Nature-Quotes-1.jpg,Snowy mountain ,286
Lindsay Evans,Sultry pleasure,https://upload.wikimedia.org/wikipedia/commons/f/f9/Phoenicopterus_ruber_in_S%C3%A3o_Paulo_Zoo.jpg,2013,Stepping to a New Day Stepping to a New Day Stepping to a New Day Stepping to a New Day Stepping to a New Day Stepping to a New Day Stepping to a New Day Stepping to a New Day,https://www.awakenthegreatnesswithin.com/wp-content/uploads/2018/08/Nature-Quotes-1.jpg,Sultry pleasure,287
Lindsay Evans,The Pleasure of His Company,https://m.media-amazon.com/images/I/91bo+Vk7CwL._AC_UY218_.jpg,2017,"A taste of paradise
 
 For two weeks each year, Kingsley Diallo puts aside his responsibilities as CEO of a multibillion-dollar company and heads to Aruba. It's his chance to surf, unwind and enjoy the anonymity of just blending into a crowd. Then one day he sees Adah Palmer-Mitchell on the edge of the beach and wants to make a meaningful connection with her. Instinct tells him she's keeping a secret, but the stunning island setting and Adah's sensual beauty are an irresistible combination...
 
 Disillusioned by romance, Adah agreed to an engagement to bolster her parents' business interests. Suddenly that love-free arrangement is a sacrifice she's not sure she can make. Handsome, charismatic and confident, Kingsley awakens her dormant desires, tantalizing her with the possibility of a passionate future. As their dangerous game of attraction escalates, can she choose between family loyalty...and the call of her heart?",https://www.amazon.com/Pleasure-Company-Miami-Strong-Book-ebook/dp/B01LLPCDB6/ref=sr_1_1?dchild=1&keywords=The+Pleasure+of+His+Company+Lindsay+Evans&qid=1615775327&s=books&sr=1-1,The pleasure of his company,288
Lindsay Evans,Untamed Love,https://m.media-amazon.com/images/I/91YDHRFNTlL._AC_UY218_.jpg,2016,"The one you can't resist...
 
 A winning bid at a silent auction gets Mella Davis more than just complimentary services from landscape architect Victor Raphael. It sparks an instantaneous attraction to the brooding bachelor that takes her completely by surprise. Stern and tightly wound on the surface, irresistibly masculine underneath, he's a challenge to her single-and-loving-it statusand to the heart she's learned to protect. And still, she can't help giving in.
 
 Ever since love burned him in the past, nothing has cracked Victor's calm control. Then he glimpses carefree, vivacious Mella at a Miami charity event. Uninhibited days and sensual nights follow as she brings warmth and desire back to his world, until doubt wrenches them apart. Opposites attract, but can they also overcome their differences...and sow the seeds to thrilling and lasting love?",https://www.amazon.com/Untamed-Love-Kimani-Romance-Book-ebook/dp/B0105YDFVG/ref=sr_1_1?dchild=1&keywords=Untamed+Love+Lindsay+Evans&qid=1615773678&s=books&sr=1-1,Untamed love,289
Mia Sosa,Acting on impulse,https://upload.wikimedia.org/wikipedia/commons/f/f9/Phoenicopterus_ruber_in_S%C3%A3o_Paulo_Zoo.jpg,2013,Stepping to a New Day Stepping to a New Day Stepping to a New Day Stepping to a New Day Stepping to a New Day Stepping to a New Day Stepping to a New Day Stepping to a New Day,https://www.awakenthegreatnesswithin.com/wp-content/uploads/2018/08/Nature-Quotes-1.jpg,Acting on impulse,190
Mia Sosa,The wedding crasher,https://upload.wikimedia.org/wikipedia/commons/f/f9/Phoenicopterus_ruber_in_S%C3%A3o_Paulo_Zoo.jpg,2013,Stepping to a New Day Stepping to a New Day Stepping to a New Day Stepping to a New Day Stepping to a New Day Stepping to a New Day Stepping to a New Day Stepping to a New Day,https://www.awakenthegreatnesswithin.com/wp-content/uploads/2018/08/Nature-Quotes-1.jpg,The wedding crasher,191
Mia Sosa,The worst best man,https://upload.wikimedia.org/wikipedia/commons/f/f9/Phoenicopterus_ruber_in_S%C3%A3o_Paulo_Zoo.jpg,2013,Stepping to a New Day Stepping to a New Day Stepping to a New Day Stepping to a New Day Stepping to a New Day Stepping to a New Day Stepping to a New Day Stepping to a New Day,https://www.awakenthegreatnesswithin.com/wp-content/uploads/2018/08/Nature-Quotes-1.jpg,The worst best man ,192
Mimi Grace,Along for the Ride,https://m.media-amazon.com/images/I/81TyjvPOS+L._AC_UY218_.jpg,2019,"This road to love may have a few speed bumps...
 
 Former hot mess Jolene Baxter is committed to doing better. It's why she offered to help her sister and brother-in-law move across the country. However, her goodwill is tested when last minute changesmainly her father ditching her for an all-expenses paid vacationforces her to make the journey with a man who is the human version of a pebble in her shoe.
 
 Jason Akana operates on lists and bitter coffee, but none of those things will help him on a sixteen-hour trip with the most infuriating woman. Maybe they can get along and forget their heated confrontation five years ago at his best friend's wedding...when pigs fly.
 
 But the addition of vehicle problems, an unplanned pit stop in a small town, and chemistry that inconveniently tags along, shifts their perspectives. And once the dust settles after their trip, a tentative friendship emerges. Will these two stubborn people successfully navigate the unexpected feelings that follow close behind? Or will they hit a roadblock before reaching happily ever after?",https://www.amazon.com/Along-Ride-Mimi-Grace-ebook/dp/B07RZPYRTW/ref=sr_1_1?dchild=1&keywords=Along+for+the+Ride+Mimi+Grace&qid=1615776096&s=books&sr=1-1,Along for the ride,301
Mimi Grace,Make a Scene,https://m.media-amazon.com/images/I/81-1xNlLs0L._AC_UY218_.jpg,2020,"Faking this relationship should be a piece of cake.
 
 Retta Majors is having a bad day. But that's to be expected when your ex gets engaged to your cousin. Instead of (totally) freaking out, Retta decides to attend the wedding with her amazing, faithful, and handsome boyfriend. One problem...He doesn't exist.
 
 Duncan Gilmore is living his dream. His boxing gym is open for business, and he's focused on success. The last thing on his mind is a relationship. That is until the beautiful baker next door makes him an offer so bizarre, he can't refuse. One weekend of pretending to be Retta's boyfriend should be easy.
 
 However, shared kisses and some flirting start to blur the lines in their fake relationship. When their performance draws to a close, will they go their separate ways or return for an encore?",https://www.amazon.com/Make-Scene-Mimi-Grace-ebook/dp/B08DHFNMXR/ref=sr_1_2?dchild=1&keywords=make+a+scene&qid=1615774503&s=books&sr=1-2,Make a scene,302
Naima Simone,A perfect fit,https://upload.wikimedia.org/wikipedia/commons/f/f9/Phoenicopterus_ruber_in_S%C3%A3o_Paulo_Zoo.jpg,2013,Stepping to a New Day Stepping to a New Day Stepping to a New Day Stepping to a New Day Stepping to a New Day Stepping to a New Day Stepping to a New Day Stepping to a New Day,,A perfect fit,247
Naima Simone,Beauty and the Bachelor,https://m.media-amazon.com/images/I/81l6KvncXrL._AC_UY218_.jpg,2015,"She may be the highest bidder, but this bachelor's price is blackmail and passion..
 Billionaire Lucas Oliver is hell bent on revenge. And his plan begins when Sydney Blake-the stunning daughter of his enemy-is tricked into bidding on Lucas at a bachelor auction. Then he serves up a little blackmail... followed by a marriage proposal Sydney has no choice but to accept.
 
 Sydney has been controlled by her family her whole life. When Lucas threatens to reveal her father's shady business, she is once again forced to do her duty for her family. But worse-oh so much worse-is the rush of lust that Lucas ignites in her blood.
 Lucas is determined to make Sydney suffer, but it's tough when he can't keep from touching her-or thinking about touching her-all the time. She's not fairing much better since she's engaged to a darkly handsome beast intent on destroying her entire family...along with her heart.",https://www.amazon.com/Beauty-Bachelor-Auction-Book-ebook/dp/B0122RZLTI/ref=sr_1_1?dchild=1&keywords=Beauty+and+the+Bachelor+Naima+Simone&qid=1615776730&s=digital-text&sr=1-1,Beauty and bachelor,248
Naima Simone,Blame It on the Billionaire,https://m.media-amazon.com/images/I/81tYUQswJOL._AC_UY218_.jpg,2020,"One night in a blackout leads to a fake engagement between an assistant and her boss in this Blackout Billionaires novel by USA TODAY bestselling author Naima Simone.
 
 Executive assistant Nadia Jordan has long had a secret crush on CEO Grayson Chandler, but the start-up billionaire doesn't even know she exists. When she falls into his arms at the Du Sable Gala, and the lights go out in a citywide blackout, one kiss leads to a night of soul-stealing passion. And what happens in the dark never stays in the dark...
 
 Because Grayson sees his chance to evade his matchmaking mother by making a proposal Nadia can't refuseshe'll be his fake fiance! As she steps into Grayson's privileged Chicago world, will his mother and vengeful ex destroy her dreams? Or will her fake fianc make those dreams a reality?",https://www.amazon.com/Blame-Billionaire-Blackout-Billionaires-Book-ebook/dp/B07WRLSRS3/ref=sr_1_2?dchild=1&keywords=Blame+It+on+the+Billionaire+Naima+Simone&qid=1615775744&s=books&sr=1-2,Blame it on the billionaire,249
Naima Simone,Claiming christmas,https://upload.wikimedia.org/wikipedia/commons/f/f9/Phoenicopterus_ruber_in_S%C3%A3o_Paulo_Zoo.jpg,2013,Stepping to a New Day Stepping to a New Day Stepping to a New Day Stepping to a New Day Stepping to a New Day Stepping to a New Day Stepping to a New Day Stepping to a New Day,https://www.awakenthegreatnesswithin.com/wp-content/uploads/2018/08/Nature-Quotes-1.jpg,Claiming christmas ,250
Naima Simone,Love and protect,https://upload.wikimedia.org/wikipedia/commons/f/f9/Phoenicopterus_ruber_in_S%C3%A3o_Paulo_Zoo.jpg,2013,Stepping to a New Day Stepping to a New Day Stepping to a New Day Stepping to a New Day Stepping to a New Day Stepping to a New Day Stepping to a New Day Stepping to a New Day,https://www.awakenthegreatnesswithin.com/wp-content/uploads/2018/08/Nature-Quotes-1.jpg,Love and protect,251
Naima Simone,Loving the beast,https://upload.wikimedia.org/wikipedia/commons/f/f9/Phoenicopterus_ruber_in_S%C3%A3o_Paulo_Zoo.jpg,2013,Stepping to a New Day Stepping to a New Day Stepping to a New Day Stepping to a New Day Stepping to a New Day Stepping to a New Day Stepping to a New Day Stepping to a New Day,https://www.awakenthegreatnesswithin.com/wp-content/uploads/2018/08/Nature-Quotes-1.jpg,Loving the beast,252
Naima Simone,Scoring off the field,https://upload.wikimedia.org/wikipedia/commons/f/f9/Phoenicopterus_ruber_in_S%C3%A3o_Paulo_Zoo.jpg,2013,Stepping to a New Day Stepping to a New Day Stepping to a New Day Stepping to a New Day Stepping to a New Day Stepping to a New Day Stepping to a New Day Stepping to a New Day,https://www.awakenthegreatnesswithin.com/wp-content/uploads/2018/08/Nature-Quotes-1.jpg,Scoring off the field,253
Naima Simone,Scoring othe player's baby,https://upload.wikimedia.org/wikipedia/commons/f/f9/Phoenicopterus_ruber_in_S%C3%A3o_Paulo_Zoo.jpg,2013,Stepping to a New Day Stepping to a New Day Stepping to a New Day Stepping to a New Day Stepping to a New Day Stepping to a New Day Stepping to a New Day Stepping to a New Day,https://www.awakenthegreatnesswithin.com/wp-content/uploads/2018/08/Nature-Quotes-1.jpg,Scoring othe player's baby,254
Naima Simone,Scoring with the wrong twin,https://upload.wikimedia.org/wikipedia/commons/f/f9/Phoenicopterus_ruber_in_S%C3%A3o_Paulo_Zoo.jpg,2013,Stepping to a New Day Stepping to a New Day Stepping to a New Day Stepping to a New Day Stepping to a New Day Stepping to a New Day Stepping to a New Day Stepping to a New Day,https://www.awakenthegreatnesswithin.com/wp-content/uploads/2018/08/Nature-Quotes-1.jpg,Scoring with the wrong twin ,255
Naima Simone,Sin and ink,https://upload.wikimedia.org/wikipedia/commons/f/f9/Phoenicopterus_ruber_in_S%C3%A3o_Paulo_Zoo.jpg,2013,Stepping to a New Day Stepping to a New Day Stepping to a New Day Stepping to a New Day Stepping to a New Day Stepping to a New Day Stepping to a New Day Stepping to a New Day,https://www.awakenthegreatnesswithin.com/wp-content/uploads/2018/08/Nature-Quotes-1.jpg,Sin and ink,256
Nana Malone,"Game, set, match",https://upload.wikimedia.org/wikipedia/commons/f/f9/Phoenicopterus_ruber_in_S%C3%A3o_Paulo_Zoo.jpg,2013,Stepping to a New Day Stepping to a New Day Stepping to a New Day Stepping to a New Day Stepping to a New Day Stepping to a New Day Stepping to a New Day Stepping to a New Day,https://www.awakenthegreatnesswithin.com/wp-content/uploads/2018/08/Nature-Quotes-1.jpg,"Game, set, match",135
Nana Malone,London bound,https://upload.wikimedia.org/wikipedia/commons/f/f9/Phoenicopterus_ruber_in_S%C3%A3o_Paulo_Zoo.jpg,2013,Stepping to a New Day Stepping to a New Day Stepping to a New Day Stepping to a New Day Stepping to a New Day Stepping to a New Day Stepping to a New Day Stepping to a New Day,https://www.awakenthegreatnesswithin.com/wp-content/uploads/2018/08/Nature-Quotes-1.jpg,London bound ,136
Nana Malone,Royal tease,https://upload.wikimedia.org/wikipedia/commons/f/f9/Phoenicopterus_ruber_in_S%C3%A3o_Paulo_Zoo.jpg,2013,Stepping to a New Day Stepping to a New Day Stepping to a New Day Stepping to a New Day Stepping to a New Day Stepping to a New Day Stepping to a New Day Stepping to a New Day,https://www.awakenthegreatnesswithin.com/wp-content/uploads/2018/08/Nature-Quotes-1.jpg,Royal tease ,137
Nana Malone,Seductive in Stilettos,https://m.media-amazon.com/images/I/51ByV-XyiPL.jpg,2015,"A little freedom can change everything, for the Virgin and the Bad Boy.
 
 All sheltered student, Tristia Munroe, wanted was a little freedom. For the first time in four years, she's single and free of her security detail and from her past. First thing on her list? A little no-strings-attached fun. And by fun she means learning all about the world of dating and sex. Lucky for her, she's found just the right guy to teach her.
 
 Undercover security consultant, Shane Atkins, knows better than to let himself want anything - or anyone - too much. Wanting is dangerous. It leaves you vulnerable. Too bad the one and only thing he wantsthe girl he's been charged to protectis the girl he can't have.
 
 Will Shane dare to grasp his chance at happiness or will he give it all up for the mission. Will Trista be able to trust him when it matters most?
 
 Warning: Sexy, sass talking women will make you laugh, cry and want a pair of killer footwear.",https://www.amazon.com/Seductive-Stilettos-Complete-Collection-Contemporary-ebook/dp/B0146XI18O/ref=sr_1_1?dchild=1&keywords=Seductive+in+Stilettos+Nana+Malone&qid=1615772706&s=books&sr=1-1,Seductive in Stilettos,138
Nana Malone,Sultry in Stilettos,https://m.media-amazon.com/images/I/815qIDUvOWL._AC_UY218_.jpg,2012,"No man in his right mind falls for his best friend. It's always a recipe for disaster. Especially when she works with you.
 
 But I am not in my right mind. One kiss from Ricca Munroe changes everything. I need my job to fulfill a promise, but Ricca is a distraction and one hell of an opponent in the office.
 
 All I have to do is resist the seductive charms of my best friend. But she's just as determined to win as I am, and both of us are playing dirty.
 
 I can resist her right? How hard can that be?",https://www.amazon.com/Sultry-Stilettos-Contemporary-Romance-ebook/dp/B00A64ETZW/ref=sr_1_1?dchild=1&keywords=Sultry+in+Stilettos+Nana+Malone&qid=1615772656&s=books&sr=1-1,Sultry in stilettos,139
Nana Malone,Tempting in stilettos,https://m.media-amazon.com/images/I/51KvjQCGftL.jpg,2013,Stepping to a New Day Stepping to a New Day Stepping to a New Day Stepping to a New Day Stepping to a New Day Stepping to a New Day Stepping to a New Day Stepping to a New Day,https://www.awakenthegreatnesswithin.com/wp-content/uploads/2018/08/Nature-Quotes-1.jpg,Tempting in stilettos,140
Nana Malone,The billionaire's secret,https://upload.wikimedia.org/wikipedia/commons/f/f9/Phoenicopterus_ruber_in_S%C3%A3o_Paulo_Zoo.jpg,2013,Stepping to a New Day Stepping to a New Day Stepping to a New Day Stepping to a New Day Stepping to a New Day Stepping to a New Day Stepping to a New Day Stepping to a New Day,https://www.awakenthegreatnesswithin.com/wp-content/uploads/2018/08/Nature-Quotes-1.jpg,The billionaire's secret,141
Pepper Pace,A seal upon your heart,https://upload.wikimedia.org/wikipedia/commons/f/f9/Phoenicopterus_ruber_in_S%C3%A3o_Paulo_Zoo.jpg,2013,Stepping to a New Day Stepping to a New Day Stepping to a New Day Stepping to a New Day Stepping to a New Day Stepping to a New Day Stepping to a New Day Stepping to a New Day,https://www.awakenthegreatnesswithin.com/wp-content/uploads/2018/08/Nature-Quotes-1.jpg,A seal upon your heart,51
Pepper Pace,A wrong turn toward love,https://upload.wikimedia.org/wikipedia/commons/f/f9/Phoenicopterus_ruber_in_S%C3%A3o_Paulo_Zoo.jpg,2013,Stepping to a New Day Stepping to a New Day Stepping to a New Day Stepping to a New Day Stepping to a New Day Stepping to a New Day Stepping to a New Day Stepping to a New Day,https://www.awakenthegreatnesswithin.com/wp-content/uploads/2018/08/Nature-Quotes-1.jpg,A wrong turn toward love,52
Pepper Pace,Babygirl and the mean boss,https://upload.wikimedia.org/wikipedia/commons/f/f9/Phoenicopterus_ruber_in_S%C3%A3o_Paulo_Zoo.jpg,2013,Stepping to a New Day Stepping to a New Day Stepping to a New Day Stepping to a New Day Stepping to a New Day Stepping to a New Day Stepping to a New Day Stepping to a New Day,https://www.awakenthegreatnesswithin.com/wp-content/uploads/2018/08/Nature-Quotes-1.jpg,Babygirl and the mean boss,53
Pepper Pace,Beast,https://upload.wikimedia.org/wikipedia/commons/f/f9/Phoenicopterus_ruber_in_S%C3%A3o_Paulo_Zoo.jpg,2013,Stepping to a New Day Stepping to a New Day Stepping to a New Day Stepping to a New Day Stepping to a New Day Stepping to a New Day Stepping to a New Day Stepping to a New Day,https://www.awakenthegreatnesswithin.com/wp-content/uploads/2018/08/Nature-Quotes-1.jpg,Beast,54
Pepper Pace,Crash,https://upload.wikimedia.org/wikipedia/commons/f/f9/Phoenicopterus_ruber_in_S%C3%A3o_Paulo_Zoo.jpg,2013,Stepping to a New Day Stepping to a New Day Stepping to a New Day Stepping to a New Day Stepping to a New Day Stepping to a New Day Stepping to a New Day Stepping to a New Day,https://www.awakenthegreatnesswithin.com/wp-content/uploads/2018/08/Nature-Quotes-1.jpg,Crash,55
Pepper Pace,Juicy,https://upload.wikimedia.org/wikipedia/commons/f/f9/Phoenicopterus_ruber_in_S%C3%A3o_Paulo_Zoo.jpg,2013,Stepping to a New Day Stepping to a New Day Stepping to a New Day Stepping to a New Day Stepping to a New Day Stepping to a New Day Stepping to a New Day Stepping to a New Day,https://www.awakenthegreatnesswithin.com/wp-content/uploads/2018/08/Nature-Quotes-1.jpg,Juicy ,56
Pepper Pace,Miscegenis,https://upload.wikimedia.org/wikipedia/commons/f/f9/Phoenicopterus_ruber_in_S%C3%A3o_Paulo_Zoo.jpg,2013,Stepping to a New Day Stepping to a New Day Stepping to a New Day Stepping to a New Day Stepping to a New Day Stepping to a New Day Stepping to a New Day Stepping to a New Day,https://www.awakenthegreatnesswithin.com/wp-content/uploads/2018/08/Nature-Quotes-1.jpg,Miscegenis ,57
Pepper Pace,Stranded,https://m.media-amazon.com/images/I/51aG9Mkg5WL.jpg,2011,"This first novel published by author Pepper Pace continues to remain one of her most enduring reads. Now, re-edited, Stranded promises to be even more entertaining.
 
 Oceans Delano and Marshall Cohen could not be any different. She is a shy Jamaican born woman returning to the states after her father's death. Marshall Cohen is a privileged young businessman traveling out of the country to engage in 'sketchy' business dealings for his boss. When their small plane crashes, the two lone survivors are forced to depend on each other and in the process they learn to face their fears and to accept their differences. Caution: Includes graphic descriptions, sex and language.",https://www.amazon.com/STRANDED-Pepper-Pace-ebook/dp/B0067A2S5C/ref=sr_1_1?dchild=1&keywords=Stranded+Pepper+Pace&qid=1615778178&s=digital-text&sr=1-1,Stranded,58
Pepper Pace,The Throwaway Year,https://m.media-amazon.com/images/I/51o0JnII9zL._SY346_.jpg,2013,"Hayden Michaels had given six years of her life to MyKell before he informed her that things hadn't been right for a while. He had met someone else. And that's when she opened her eyes and saw the mess that she was; financially, emotionally and physically. Never able to maintain the discipline to carry through with any weight loss goal, Hayden makes a bold decision. She will throwaway an entire year of her life; moving towards her goals with no thought of pleasure or pain.
 
 As she recreates herself Hayden meets situations and people that help her to realize her worth, namely a man who has been written off by society. But the question becomes whether Hayden can accept the faults of someone else without allowing herself to go backwards?",https://www.amazon.com/Throwaway-Year-Pepper-Pace-ebook/dp/B00FIUDIRO/ref=sr_1_1?dchild=1&keywords=The+Throwaway+Year+Pepper+Pace&qid=1615778338&s=digital-text&sr=1-1,The throwaway year,70
Pepper Pace,They say love is blind,https://upload.wikimedia.org/wikipedia/commons/f/f9/Phoenicopterus_ruber_in_S%C3%A3o_Paulo_Zoo.jpg,2013,Stepping to a New Day Stepping to a New Day Stepping to a New Day Stepping to a New Day Stepping to a New Day Stepping to a New Day Stepping to a New Day Stepping to a New Day,https://www.awakenthegreatnesswithin.com/wp-content/uploads/2018/08/Nature-Quotes-1.jpg,They say love is blind,71
Pepper Pace,Wheels of Steel 1,https://m.media-amazon.com/images/I/51+FAYm28vL.jpg,2013,"Jason, better known as Top, is an up and coming DJ. He's a white guy that knows more about Hip Hop than most and he also has cerebral palsy. His group Wheels of Steel is comprised of self-proclaimed misfits that are made cool by their talent. But despite his talent and popularity, Jason is plagued by issues of trust and anger.
 
 Robin is a shy black girl that takes a job as his home healthcare aid. Her crippling nervous condition makes everything difficult for her, not just her bad tempered client with cerebral palsy, but also his close knit friends, and even her mother with her best intentions. Their saga takes them along a musical journey of self-discovery and love.
 
 This three part interracial love story explores the spirit of love and acceptance between a person with an obvious disabilityand someone whose disabilities are not always quite so obvious.",https://www.amazon.com/Wheels-Steel-Book-Pepper-Pace-ebook/dp/B006SJOVX4/ref=sr_1_2?dchild=1&keywords=Wheels+of+steel+1+Pepper+Pace&qid=1615777915&s=digital-text&sr=1-2,Wheels of steel 1,72
Pepper Pace,Wheels of Steel 2,https://m.media-amazon.com/images/I/51nqvObmTZL._AC_UY218_.jpg,2013,"In book 1 you were introduced to Robin and Jason; a talented young man with cerebral palsy and his introverted caregiver. Their dawning love transcended their racial and social difference. Now in book 2 Jason and Robin along with the other member of Wheels of Steel find themselves spiraling away from each other. The ultimate question that each of them will face is; can there be forgiveness after betrayal?
 
 Wheels of Steel is 3 part saga that is more than just an interracial love story. It is a journey of music, love, betrayal and trust. This story contains graphic sex and language and is intended for mature readers only.",https://www.amazon.com/Wheels-Steel-Book-Pepper-Pace-ebook/dp/B006UZ70P2/ref=sr_1_2?dchild=1&keywords=Wheels+of+Steel+2+Pepper+Pace&qid=1615776938&s=digital-text&sr=1-2,Wheels of steel 2,73
Pepper Pace,Wheels of steel 3,https://upload.wikimedia.org/wikipedia/commons/f/f9/Phoenicopterus_ruber_in_S%C3%A3o_Paulo_Zoo.jpg,2013,Stepping to a New Day Stepping to a New Day Stepping to a New Day Stepping to a New Day Stepping to a New Day Stepping to a New Day Stepping to a New Day Stepping to a New Day,https://www.awakenthegreatnesswithin.com/wp-content/uploads/2018/08/Nature-Quotes-1.jpg,Wheels of steel 3,74
